1,ユニコーン-3b5602760869addf0e71b2a3466072b5.png,ユニコーンx2,光,8370,1,376650,220,突進（先制攻撃2093）<br>セイントホーン（8370ダメージ＆ランダム1色→光ドロップ）
2,聖天地の守神・エンジェル-1deb6831c3741ba5a78fcf8982e4a873.png,聖天地の守神・エンジェル,光,6333,1,870069,725,天使の冷笑（先制・ランダム1色排除）<br>シャイニングレイ（4750ダメージ＆ランダム1色→光ドロップ）<br>サディスティックスイッチ（999ターン攻撃力2倍）※HP75%以下で使用<br>ハートブレイク（3167ダメージ＆回復ドロップ排除）※HP30%以下で使用
3,-,いずれか1体が出現,-,-,-,-,-,-
3,龍焔の熾天使・ウリエル-9d2e97a8fbab56f5aa30c2afeeed2b4e.png,神炎の熾天使・ウリエル,火光,9500,1,1391389,360,戒めの鎖（7125ダメージ＆1体2～3ターンバインド）<br>聖炎の奇跡（14250ダメージ＆ランダム1色→回復ドロップ）<br>久遠の業火（7125ダメージ＆回復ドロップ→火ドロップ）※HP50%以下で使用
3,神託の大天使・ガブリエル-2cf6e47d6ce1d4fb0c4ad55aa8ac75f4.png,神託の大天使・ガブリエル,水光,-,2,627500,360,天使の囁き（先制・リーダー5ターンバインド）<br>神言・終わりの日（残りHP99％ダメージ）<br>召喚・カサブランカ（連続攻撃14532）<br>神秘の白百合（HP全回復）※HP50%以下で使用
3,護法の大天使・ミカエル-9e0830e1e829988efd287527f0c31514.png,護法の大天使・ミカエル,木光,-,1,43,600000,守護結界（先制・4ターン状態異常無効）<br>封印結界（リーダーとフレンドを4ターンバインド）<br>魂の天秤（1回目3243・2回目6486・3回目12972・4回目51888）
4,神癒の大天使・ラファエル-6c24f0d9ee38ade1e979003c65eb9eb3.png,神癒の大天使・ラファエル,光,-,5,2582361,0,神癒の奇跡（先制・10ターン闇属性吸収）<br>永遠の安らぎ（連続攻撃134004）
5,覚醒サンダルフォン-5c230a34d6536a74019e19882bf2861c.png,覚醒サンダルフォン,光水,-,1,3831736,670,天使の賛美歌（先制・3ターンスキル使用不可）<br>浄化の旋律（9122ダメージ＆闇ドロップ→光ドロップ）<br>ソード・オブ・マルクト（連続攻撃13684）<br>幽閉の鳥籠（神タイプ10ターンバインド、1度きり）※HP50%以下で使用<br>裁きの瞑奏（連続攻撃23946）※HP30%以下で使用
